field,current_judgment,review_question,blocked_by,pass_condition
jurisdiction,activation authority governs enactment boundary without owning scheduler law,does the draft stay focused on activation rather than planning or queueing,confusion with scheduler and runtime surfaces,draft clearly separates activation request/decision from future-work compilation
carrier_neutrality,manual IDE daemon API and later bounded multi-carrier enactment should share one activation law,does the draft preserve one workflow across carriers,carrier-specific convenience language,draft binds all carriers to same request-decision-receipt structure
anti_theater,the draft must avoid fake manager swarm mythology,does the draft refuse theatrical autonomous claims,import pressure from historical vivid activation lines,draft names bounded activation classes without role inflation
continuation_boundary,continuation and takeover remain substrate not replacement activation law,does the draft avoid rewriting continuation ontology,existing handoff/takeover protocol overlap,draft references but does not subsume continuation protocols
lifecycle_boundary,executor lifecycle remains a separate follow-on protocol,does the draft avoid claim/release/failure overreach,temptation to solve lifecycle in same document,draft leaves transition mechanics to future executor lifecycle law
review_posture,this draft remains quarantined until formal thaw review,does the repo expose its non-active status clearly,premature path confusion,draft and indices mark review-only status unambiguously
