dimension,historical_center,current_branch_center,delta_judgment,reintegration_target,risk_if_misread
activation_locus,explicit orchestrator or swarm owns activation,activation is distributed across scheduler entry capability and handoff surfaces,current branch lacks one named activation authority center,restore separate activation authority protocol,mistaking distributed startup law for a full activation center
executor_lifecycle,spawn suspend terminate and monitor are explicit runtime acts,executor readiness and entry are explicit but lifecycle semantics are fragmented,current branch is stronger on readiness than lifecycle completeness,restore explicit executor lifecycle protocol,smuggling old manager semantics into scheduler language
parallel_role_semantics,named scout architect mutator validator strategist cycle,current branch favors packets carriers and bounded child work,current branch avoids theater but under-specifies role-cycle truth,restore bounded activation semantics without role fetish,confusing named roles with lawful orchestration
carrier_binding,implicit runtime-specific agent boot paths,explicit executor capability registry and trust posture,current branch is stronger here,preserve capability registry as binding floor,losing current capability discipline during restoration
handoff_and_reentry,weaker packetized continuation and replay chain,strong takeover validation capsule materialization and entry rehearsal,current branch is stronger here,preserve M14 M15 M16 chain,restoration becomes nostalgia instead of lawful continuity
bounded_parallelism,swarm runs real parallel mutators but with looser settlement law,allocator and branch controls enforce bounded fan out and write conflict rules,current branch is safer but less activation-explicit,link activation authority to allocator rather than bypass it,reviving fake autonomous multi-agent execution
manual_automation_relation,historical center is more runtime-native,one workflow across manual and automated carriers is explicit,current branch is constitutionally stronger,preserve manual automation equivalence law,creating a second automation-only workflow
failure_and_release,suspend or terminate are explicit operational acts,review threshold and governed landing are stronger than fleet-level release semantics,both centers hold different strengths,restore lifecycle release semantics under current review law,activation center becomes pure narrative without settlement
